### ISSUE TITLE
STS endpoint do not work for China --api-server flag is being ignored

### ISSUE THREAD

**Issue by pl4st1k** [jtblin/kube2iam#93]
Hey,
STS for china (cn-north-1) needs to use sts.cn-north-1.amazonaws.com.cn instead of standard sts.amazonaws.com.

I've added --api-server=sts.cn-north-1.amazonaws.com.cn but flag is being ignored by kube2iam

Tech stuff below:
dig sts.cn-north-1.amazonaws.com.cn +short
54.222.5.9

dig sts.amazonaws.com +short
54.239.21.217

TCPDUMP:
15:32:42.680929 IP 10.1XX.6.95.60964 > 10.1XX.6.2.domain: 6167+ A? sts.amazonaws.com. (35)
E..?..@.@.P.
.._
....$.5.+!..............sts	amazonaws.com.....................
15:32:42.680938 IP 10.1XX.6.95.38968 > 10.1XX.6.2.domain: 11978+ AAAA? sts.amazonaws.com. (35)
E..?..@.@.P.
.._
....8.5.+!..............sts	amazonaws.com.....................
15:32:42.681698 IP 10.1XX.6.2.domain > 10.1XX.6.95.60964: 6167 1/0/0 A 54.239.21.217 (51)

Version:
docker.io/jtblin/kube2iam                                 latest              sha256:0cfaebf12ffa41b2284a598bba37339ae3dde1f0702c54c98663d1e8b2b08263   a6491f206c87

-------Edit--------
Proper endpoint is being used when env variable AWS_REGION is set up to desired region. But --api-server flag is still ignored.

Best regards

**Comment by jtblin** [comment]
`--api-server` is for the location of the kubernetes api server, not the AWS STS endpoint. I believe you can change the AWS STS endpoint via [environment variables](https://docs.aws.amazon.com/sdk-for-go/v1/developer-guide/configuring-sdk.html) i.e. `AWS_REGION`. You can pass the environment variable to kube2iam using kubernetes env config.
